{
    "$id": "https://github.com/fmohr/SEDE/tree/master/SEDE.core/src/main/resources/json-schema/requests/RunRequest.schema.json",
    "type": "object",
    "definitions": {},
    "$schema": "http://json-schema.org/draft-06/schema#",
    "properties": {
        "composition": {
            "$ref": "SequentialComposition.schema.json"
        },
        "requestId": {
            "type": "string",
            "examples": [
                "exec-id-0"
            ]
        },
        "inputs": {
            "type": "object"
        },
        "policy": {
            "$ref": "ResolvePolicy.schema.json"
        }
    }
}